Text,Is Capitalized,Is Roman Numeral,Is Number,is_heading,is_figure_heading,is_table_heading
ABSTRACT,True,False,False,True,False,False
In this paper we address the issue of learning to rank for document,False,False,False,False,False,False
"retrieval. In the task, a model is automatically created with some",False,False,False,False,False,False
training data and then is utilized for ranking of documents. The,False,False,False,False,False,False
goodness of a model is usually evaluated with performance mea-,False,False,False,False,False,False
sures such as MAP (Mean Average Precision) and NDCG (Nor-,False,False,False,False,False,False
malized Discounted Cumulative Gain). Ideally a learning algo-,False,False,False,False,False,False
rithm would train a ranking model that could directly optimize the,False,False,False,False,False,False
performance measures with respect to the training data. Existing,False,False,False,False,False,False
"methods, however, are only able to train ranking models by mini-",False,False,False,False,False,False
mizing loss functions loosely related to the performance measures.,False,False,False,False,False,False
"For example, Ranking SVM and RankBoost train ranking mod-",False,False,False,False,False,False
els by minimizing classiﬁcation errors on instance pairs. To deal,False,False,False,False,False,False
"with the problem, we propose a novel learning algorithm within",False,False,False,False,False,False
"the framework of boosting, which can minimize a loss function",False,False,False,False,False,False
"directly deﬁned on the performance measures. Our algorithm, re-",False,False,False,False,False,False
"ferred to as AdaRank, repeatedly constructs ‘weak rankers’ on the",False,False,False,False,False,False
basis of re-weighted training data and ﬁnally linearly combines the,False,False,False,False,False,False
weak rankers for making ranking predictions. We prove that the,False,False,False,False,False,False
training process of AdaRank is exactly that of enhancing the per-,False,False,False,False,False,False
formance measure used. Experimental results on four benchmark,False,False,False,False,False,False
datasets show that AdaRank signiﬁcantly outperforms the baseline,False,False,False,False,False,False
"methods of BM25, Ranking SVM, and RankBoost.",False,False,False,False,False,False
Categories and Subject Descriptors,False,False,False,False,False,False
H.3.3 [Information Search and Retrieval]: Retrieval models,False,False,False,False,False,False
General Terms,False,False,False,False,False,False
"Algorithms, Experimentation, Theory",False,False,False,False,False,False
Keywords,False,False,False,False,False,False
"Information retrieval, Learning to rank, Boosting",False,False,False,False,False,False
1. INTRODUCTION,True,False,True,True,False,False
Recently ‘learning to rank’ has gained increasing attention in,False,False,False,False,False,False
both the ﬁelds of information retrieval and machine learning. When,False,False,False,False,False,False
Permission to make digital or hard copies of all or part of this work for,False,False,False,False,False,False
personal or classroom use is granted without fee provided that copies are,False,False,False,False,False,False
not made or distributed for proﬁt or commercial advantage and that copies,False,False,False,False,False,False
"bear this notice and the full citation on the ﬁrst page. To copy otherwise, to",False,False,False,False,False,False
"republish, to post on servers or to redistribute to lists, requires prior speciﬁc",False,False,False,False,False,False
permission and/or a fee.,False,False,False,False,False,False
"SIGIR’07, July 23–27, 2007, Amsterdam, The Netherlands.",False,False,False,False,False,False
Copyright 2007 ACM 978-1-59593-597-7/07/0007 ...$5.00.,False,False,False,False,False,False
"applied to document retrieval, learning to rank becomes a task as",False,False,False,False,False,False
"follows. In training, a ranking model is constructed with data con-",False,False,False,False,False,False
"sisting of queries, their corresponding retrieved documents, and rel-",False,False,False,False,False,False
"evance levels given by humans. In ranking, given a new query, the",False,False,False,False,False,False
corresponding retrieved documents are sorted by using the trained,False,False,False,False,False,False
"ranking model. In document retrieval, usually ranking results are",False,False,False,False,False,False
evaluated in terms of performance measures such as MAP (Mean,False,False,False,False,False,False
Average Precision) [1] and NDCG (Normalized Discounted Cumu-,False,False,False,False,False,False
"lative Gain) [15]. Ideally, the ranking function is created so that the",False,False,False,False,False,False
accuracy of ranking in terms of one of the measures with respect to,False,False,False,False,False,False
the training data is maximized.,False,False,False,False,False,False
Several methods for learning to rank have been developed and,False,False,False,False,False,False
"applied to document retrieval. For example, Herbrich et al. [13]",False,False,False,False,False,False
propose a learning algorithm for ranking on the basis of Support,False,False,False,False,False,False
"Vector Machines, called Ranking SVM. Freund et al. [8] take a",False,False,False,False,False,False
"similar approach and perform the learning by using boosting, re-",False,False,False,False,False,False
ferred to as RankBoost. All the existing methods used for docu-,False,False,False,False,False,False
"ment retrieval [2, 3, 8, 13, 16, 20] are designed to optimize loss",False,False,False,False,False,False
"functions loosely related to the IR performance measures, not loss",False,False,False,False,False,False
"functions directly based on the measures. For example, Ranking",False,False,False,False,False,False
SVM and RankBoost train ranking models by minimizing classiﬁ-,False,False,False,False,False,False
cation errors on instance pairs.,False,False,False,False,False,False
"In this paper, we aim to develop a new learning algorithm that",False,False,False,False,False,False
can directly optimize any performance measure used in document,False,False,False,False,False,False
"retrieval. Inspired by the work of AdaBoost for classiﬁcation [9],",False,False,False,False,False,False
we propose to develop a boosting algorithm for information re-,False,False,False,False,False,False
"trieval, referred to as AdaRank. AdaRank utilizes a linear com-",False,False,False,False,False,False
"bination of ‘weak rankers’ as its model. In learning, it repeats the",False,False,False,False,False,False
"process of re-weighting the training sample, creating a weak ranker,",False,False,False,False,False,False
and calculating a weight for the ranker.,False,False,False,False,False,False
We show that AdaRank algorithm can iteratively optimize an ex-,False,False,False,False,False,False
ponential loss function based on any of IR performance measures.,False,False,False,False,False,False
"A lower bound of the performance on training data is given, which",False,False,False,False,False,False
indicates that the ranking accuracy in terms of the performance,False,False,False,False,False,False
measure can be continuously improved during the training process.,False,False,False,False,False,False
"AdaRank oﬀers several advantages: ease in implementation, the-",False,False,False,False,False,False
"oretical soundness, eﬃciency in training, and high accuracy in ranking.",False,False,False,False,False,False
Experimental results indicate that AdaRank can outperform the base-,False,False,False,False,False,False
"line methods of BM25, Ranking SVM, and RankBoost, on four",False,False,False,False,False,False
"benchmark datasets including OHSUMED, WSJ, AP, and .Gov.",False,False,False,False,False,False
Tuning ranking models using certain training data and a perfor-,False,False,False,False,False,False
mance measure is a common practice in IR [1]. As the number of,False,False,False,False,False,False
features in the ranking model gets larger and the amount of train-,False,False,False,False,False,False
"ing data gets larger, the tuning becomes harder. From the viewpoint",False,False,False,False,False,False
"of IR, AdaRank can be viewed as a machine learning method for",False,False,False,False,False,False
ranking model tuning.,False,False,False,False,False,False
"Recently, direct optimization of performance measures in learn-",False,False,False,False,False,False
ing has become a hot research topic. Several methods for classiﬁ-,False,False,False,False,False,False
SIGIR 2007 Proceedings Session 16: Learning to Rank II391,False,False,False,False,False,False
SIGIR 2007 Proceedings Session 16: Learning to Rank II,False,False,False,False,False,False
391,False,False,False,False,False,False
"cation [17] and ranking [5, 19] have been proposed. AdaRank can",False,False,False,False,False,False
be viewed as a machine learning method for direct optimization of,False,False,False,False,False,False
"performance measures, based on a diﬀerent approach.",False,False,False,False,False,False
The rest of the paper is organized as follows. After a summary,False,False,False,False,False,False
"of related work in Section 2, we describe the proposed AdaRank",False,False,False,False,False,False
algorithm in details in Section 3. Experimental results and discus-,False,False,False,False,False,False
sions are given in Section 4. Section 5 concludes this paper and,False,False,False,False,False,False
gives future work.,False,False,False,False,False,False
2. RELATED WORK,True,False,True,True,False,False
2.1 Information Retrieval,False,False,False,False,False,False
"The key problem for document retrieval is ranking, speciﬁcally,",False,False,False,False,False,False
how to create the ranking model (function) that can sort documents,False,False,False,False,False,False
based on their relevance to the given query. It is a common practice,False,False,False,False,False,False
in IR to tune the parameters of a ranking model using some labeled,False,False,False,False,False,False
"data and one performance measure [1]. For example, the state-of-",False,False,False,False,False,False
the-art methods of BM25 [24] and LMIR (Language Models for,False,False,False,False,False,False
"Information Retrieval) [18, 22] all have parameters to tune. As",False,False,False,False,False,False
the ranking models become more sophisticated (more features are,False,False,False,False,False,False
"used) and more labeled data become available, how to tune or train",False,False,False,False,False,False
ranking models turns out to be a challenging issue.,False,False,False,False,False,False
Recently methods of ‘learning to rank’ have been applied to,False,False,False,False,False,False
ranking model construction and some promising results have been,False,False,False,False,False,False
"obtained. For example, Joachims [16] applies Ranking SVM to",False,False,False,False,False,False
document retrieval. He utilizes click-through data to deduce train-,False,False,False,False,False,False
ing data for the model creation. Cao et al. [4] adapt Ranking,False,False,False,False,False,False
SVM to document retrieval by modifying the Hinge Loss function,False,False,False,False,False,False
"to better meet the requirements of IR. Speciﬁcally, they introduce",False,False,False,False,False,False
a Hinge Loss function that heavily penalizes errors on the tops of,False,False,False,False,False,False
ranking lists and errors from queries with fewer retrieved docu-,False,False,False,False,False,False
ments. Burges et al. [3] employ Relative Entropy as a loss function,False,False,False,False,False,False
and Gradient Descent as an algorithm to train a Neural Network,False,False,False,False,False,False
model for ranking in document retrieval. The method is referred to,False,False,False,False,False,False
as ‘RankNet’.,False,False,False,False,False,False
2.2 Machine Learning,False,False,False,False,False,False
There are three topics in machine learning which are related to,False,False,False,False,False,False
"our current work. They are ‘learning to rank’, boosting, and direct",False,False,False,False,False,False
optimization of performance measures.,False,False,False,False,False,False
Learning to rank is to automatically create a ranking function,False,False,False,False,False,False
that assigns scores to instances and then rank the instances by us-,False,False,False,False,False,False
ing the scores. Several approaches have been proposed to tackle,False,False,False,False,False,False
the problem. One major approach to learning to rank is that of,False,False,False,False,False,False
transforming it into binary classiﬁcation on instance pairs. This,False,False,False,False,False,False
‘pair-wise’ approach ﬁts well with information retrieval and thus is,False,False,False,False,False,False
widely used in IR. Typical methods of the approach include Rank-,False,False,False,False,False,False
"ing SVM [13], RankBoost [8], and RankNet [3]. For other ap-",False,False,False,False,False,False
"proaches to learning to rank, refer to [2, 11, 31].",False,False,False,False,False,False
"In the pair-wise approach to ranking, the learning task is formal-",False,False,False,False,False,False
ized as a problem of classifying instance pairs into two categories,False,False,False,False,False,False
"(correctly ranked and incorrectly ranked). Actually, it is known",False,False,False,False,False,False
that reducing classiﬁcation errors on instance pairs is equivalent to,False,False,False,False,False,False
"maximizing a lower bound of MAP [16]. In that sense, the exist-",False,False,False,False,False,False
"ing methods of Ranking SVM, RankBoost, and RankNet are only",False,False,False,False,False,False
able to minimize loss functions that are loosely related to the IR,False,False,False,False,False,False
performance measures.,False,False,False,False,False,False
Boosting is a general technique for improving the accuracies of,False,False,False,False,False,False
machine learning algorithms. The basic idea of boosting is to re-,False,False,False,False,False,False
peatedly construct ‘weak learners’ by re-weighting training data,False,False,False,False,False,False
and form an ensemble of weak learners such that the total perfor-,False,False,False,False,False,False
mance of the ensemble is ‘boosted’. Freund and Schapire have,False,False,False,False,False,False
proposed the ﬁrst well-known boosting algorithm called AdaBoost,False,False,False,False,False,False
"(Adaptive Boosting) [9], which is designed for binary classiﬁca-",False,False,False,False,False,False
"tion (0-1 prediction). Later, Schapire & Singer have introduced a",False,False,False,False,False,False
generalized version of AdaBoost in which weak learners can give,False,False,False,False,False,False
conﬁdence scores in their predictions rather than make 0-1 deci-,False,False,False,False,False,False
sions [26]. Extensions have been made to deal with the problems,False,False,False,False,False,False
"of multi-class classiﬁcation [10, 26], regression [7], and ranking",False,False,False,False,False,False
"[8]. In fact, AdaBoost is an algorithm that ingeniously constructs",False,False,False,False,False,False
a linear model by minimizing the ‘exponential loss function’ with,False,False,False,False,False,False
respect to the training data [26]. Our work in this paper can be,False,False,False,False,False,False
"viewed as a boosting method developed for ranking, particularly",False,False,False,False,False,False
for ranking in IR.,False,False,False,False,False,False
"Recently, a number of authors have proposed conducting direct",False,False,False,False,False,False
optimization of multivariate performance measures in learning. For,False,False,False,False,False,False
"instance, Joachims [17] presents an SVM method to directly opti-",False,False,False,False,False,False
mize nonlinear multivariate performance measures like the F,False,False,False,False,False,False
1,False,False,False,False,False,False
mea-,False,False,False,False,False,False
sure for classiﬁcation. Cossock & Zhang [5] ﬁnd a way to ap-,False,False,False,False,False,False
proximately optimize the ranking performance measure DCG [15].,False,False,False,False,False,False
Metzler et al. [19] also propose a method of directly maximizing,False,False,False,False,False,False
rank-based metrics for ranking on the basis of manifold learning.,False,False,False,False,False,False
AdaRank is also one that tries to directly optimize multivariate per-,False,False,False,False,False,False
"formance measures, but is based on a diﬀerent approach. AdaRank",False,False,False,False,False,False
is unique in that it employs an exponential loss function based on,False,False,False,False,False,False
IR performance measures and a boosting technique.,False,False,False,False,False,False
3. OUR METHOD: ADARANK,True,False,True,True,False,False
3.1 General Framework,False,False,False,False,False,False
We ﬁrst describe the general framework of learning to rank for,False,False,False,False,False,False
"document retrieval. In retrieval (testing), given a query the system",False,False,False,False,False,False
returns a ranking list of documents in descending order of the rel-,False,False,False,False,False,False
evance scores. The relevance scores are calculated with a ranking,False,False,False,False,False,False
"function (model). In learning (training), a number of queries and",False,False,False,False,False,False
"their corresponding retrieved documents are given. Furthermore,",False,False,False,False,False,False
the relevance levels of the documents with respect to the queries are,False,False,False,False,False,False
"also provided. The relevance levels are represented as ranks (i.e.,",False,False,False,False,False,False
categories in a total order). The objective of learning is to construct,False,False,False,False,False,False
a ranking function which achieves the best results in ranking of the,False,False,False,False,False,False
training data in the sense of minimization of a loss function. Ideally,False,False,False,False,False,False
the loss function is deﬁned on the basis of the performance measure,False,False,False,False,False,False
used in testing.,False,False,False,False,False,False
Suppose that Y = {r,False,False,False,False,False,False
1,False,False,False,False,False,False
", r",False,False,False,False,False,False
2,False,False,False,False,False,False
", · · · , r",False,False,False,False,False,False
`,False,False,False,False,False,False
"} is a set of ranks, where ` denotes",False,False,False,False,False,False
the number of ranks. There exists a total order between the ranks,False,False,False,False,False,False
`,False,False,False,False,False,False
 r,False,False,False,False,False,False
`−1,False,False,False,False,False,False
 · · ·  r,False,False,False,False,False,False
1,False,False,False,False,False,False
", where ‘’ denotes a preference relationship.",False,False,False,False,False,False
"In training, a set of queries Q = {q",False,False,False,False,False,False
1,False,False,False,False,False,False
", q",False,False,False,False,False,False
2,False,False,False,False,False,False
", · · · , q",False,False,False,False,False,False
m,False,False,False,False,False,False
} is given. Each,False,False,False,False,False,False
query q,False,False,False,False,False,False
i,False,False,False,False,False,False
is associated with a list of retrieved documents d,False,False,False,False,False,False
i,False,False,False,False,False,False
= {d,False,False,False,False,False,False
i1,False,False,False,False,False,False
", d",False,False,False,False,False,False
i2,False,False,False,False,False,False
",",False,False,False,False,False,False
"· · · , d",False,False,False,False,False,False
"i,n(q",False,False,False,False,False,False
i,False,False,False,False,False,False
),False,False,False,False,False,False
} and a list of labels y,False,False,False,False,False,False
i,False,False,False,False,False,False
= {y,False,False,False,False,False,False
i1,False,False,False,False,False,False
", y",False,False,False,False,False,False
i2,False,False,False,False,False,False
", · · · , y",False,False,False,False,False,False
"i,n(q",False,False,False,False,False,False
i,False,False,False,False,False,False
),False,False,False,False,False,False
"}, where n(q",False,False,False,False,False,False
i,False,False,False,False,False,False
),False,False,False,False,False,False
denotes the sizes of lists d,False,False,False,False,False,False
i,False,False,False,False,False,False
and y,False,False,False,False,False,False
i,False,False,False,False,False,False
", d",False,False,False,False,False,False
i j,False,False,False,False,False,False
denotes the j,False,False,False,False,False,False
th,False,False,False,False,False,False
document in,False,False,False,False,False,False
d,False,False,False,False,False,False
i,False,False,False,False,False,False
", and y",False,False,False,False,False,False
i j,False,False,False,False,False,False
∈ Y denotes the rank of document d,False,False,False,False,False,False
i j,False,False,False,False,False,False
. A feature vec-,False,True,False,True,False,False
tor,False,False,False,False,False,False
~,False,False,False,False,False,False
i j,False,False,False,False,False,False
= Ψ(q,False,False,False,False,False,False
i,False,False,False,False,False,False
", d",False,False,False,False,False,False
i j,False,False,False,False,False,False
) ∈ X is created from each query-document pair,False,False,False,False,False,False
(q,False,False,False,False,False,False
i,False,False,False,False,False,False
", d",False,False,False,False,False,False
i j,False,False,False,False,False,False
"), i = 1, 2, · · · , m; j = 1, 2, · · · , n(q",False,False,False,False,False,False
i,False,False,False,False,False,False
"). Thus, the training set",False,False,False,False,False,False
can be represented as S =,False,False,False,False,False,False
{,False,False,False,False,False,False
(q,False,False,False,False,False,False
i,False,False,False,False,False,False
", d",False,False,False,False,False,False
i,False,False,False,False,False,False
", y",False,False,False,False,False,False
i,False,False,False,False,False,False
),False,False,False,False,False,False
},False,False,False,False,False,False
m,False,False,False,False,False,False
i=1,False,False,False,False,False,False
.,False,True,False,True,False,False
The objective of learning is to create a ranking function f : X 7→,False,False,False,False,False,False
"<, such that for each query the elements in its corresponding doc-",False,False,False,False,False,False
ument list can be assigned relevance scores using the function and,False,False,False,False,False,False
"then be ranked according to the scores. Speciﬁcally, we create a",False,False,False,False,False,False
permutation of integers π(q,False,False,False,False,False,False
i,False,False,False,False,False,False
", d",False,False,False,False,False,False
i,False,False,False,False,False,False
", f ) for query q",False,False,False,False,False,False
i,False,False,False,False,False,False
", the correspond-",False,False,False,False,False,False
ing list of documents d,False,False,False,False,False,False
i,False,False,False,False,False,False
", and the ranking function f . Let d",False,False,False,False,False,False
i,False,False,False,False,False,False
{d,False,False,False,False,False,False
i1,False,False,False,False,False,False
", d",False,False,False,False,False,False
i2,False,False,False,False,False,False
", · · · , d",False,False,False,False,False,False
"i,n(q",False,False,False,False,False,False
i,False,False,False,False,False,False
),False,False,False,False,False,False
"} be identiﬁed by the list of integers {1, 2, · · · , n(q",False,False,False,False,False,False
i,False,False,False,False,False,False
")},",False,False,False,False,False,False
then permutation π(q,False,False,False,False,False,False
i,False,False,False,False,False,False
", d",False,False,False,False,False,False
i,False,False,False,False,False,False
", f ) is deﬁned as a bijection from {1, 2, · · · ,",False,False,False,False,False,False
n(q,False,False,False,False,False,False
i,False,False,False,False,False,False
")} to itself. We use π( j) to denote the position of item j (i.e.,",False,False,False,False,False,False
i j,False,False,False,False,False,False
). The learning process turns out to be that of minimizing the,False,False,False,False,False,False
loss function which represents the disagreement between the per-,False,False,False,False,False,False
mutation π(q,False,False,False,False,False,False
i,False,False,False,False,False,False
", d",False,False,False,False,False,False
i,False,False,False,False,False,False
", f ) and the list of ranks y",False,False,False,False,False,False
i,False,False,False,False,False,False
", for all of the queries.",False,False,False,False,False,False
SIGIR 2007 Proceedings Session 16: Learning to Rank II392,False,False,False,False,False,False
SIGIR 2007 Proceedings Session 16: Learning to Rank II,False,False,False,False,False,False
392,False,False,False,False,False,False
Table 1: Notations and explanations.,False,False,False,False,False,True
Notations Explanations,False,False,False,False,False,False
i,False,False,False,False,False,False
∈ Q i,False,False,False,False,False,False
th,False,False,False,False,False,False
query,False,False,False,False,False,False
d,False,False,False,False,False,False
i,False,False,False,False,False,False
= {d,False,False,False,False,False,False
i1,False,False,False,False,False,False
", d",False,False,False,False,False,False
i2,False,False,False,False,False,False
", · · · , d",False,False,False,False,False,False
"i,n(q",False,False,False,False,False,False
