Text,Is Capitalized,Is Roman Numeral,Is Number,is_heading,is_figure_heading,is_table_heading
•,False,False,False,False,False,False
•,False,False,False,False,False,False
Received: 21 August 2014 / Accepted: 24 February 2015,False,False,False,False,False,False
 Australasian College of Physical Scientists and Engineers in Medicine 2015,False,False,False,False,False,False
are based on individual classiﬁers or simple combination of,False,False,False,False,False,False
these classiﬁers which tend to show moderate performance.,False,False,False,False,False,False
This research paper presents a novel classiﬁer ensemble,False,False,False,False,False,False
framework based on enhanced bagging approach with,False,False,False,False,False,False
multi-objective weighted voting scheme for prediction and,False,False,False,False,False,False
analysis of heart disease. The proposed model overcomes,False,False,False,False,False,False
the limitations of conventional performance by utilizing an,False,False,False,False,False,False
ensemble of ﬁve heterogeneous classiﬁers: Naı,False,False,False,False,False,False
¨,False,False,False,False,False,False
"ve Bayes,",False,False,False,False,False,False
"linear regression, quadratic discriminant analysis, instance",False,False,False,False,False,False
based learner and support vector machines. Five different,False,False,False,False,False,False
"datasets are used for experimentation, evaluation and",False,False,False,False,False,False
validation. The datasets are obtained from publicly avail-,False,False,False,False,False,False
able data repositories. Effectiveness of the proposed,False,False,False,False,False,False
ensemble is investigated by comparison of results with,False,False,False,False,False,False
several classiﬁers. Prediction results of the proposed,False,False,False,False,False,False
ensemble model are assessed by ten fold cross validation,False,False,False,False,False,False
and ANOVA statistics. The experimental evaluation shows,False,False,False,False,False,False
that the proposed framework deals with all type of at-,False,False,False,False,False,False
"tributes and achieved high diagnosis accuracy of 84.16 %,",False,False,False,False,False,False
"93.29 % sensitivity, 96.70 % speciﬁcity, and 82.15 %",False,False,False,False,False,False
f-measure. The f-ratio higher than f-critical and p value less,False,False,False,False,False,False
than 0.05 for 95 % conﬁdence interval indicate that the,False,False,False,False,False,False
results are extremely statistically signiﬁcant for most of the,False,False,False,False,False,False
datasets.,False,False,False,False,False,False
disease  Multi-objective optimization  Prediction  Data,False,False,False,False,False,False
mining,False,False,False,False,False,False
Computational intelligence has started playing a vital role,False,False,False,False,False,False
in medical diagnosis and intelligent decision making.,False,False,False,False,False,False
Medical diagnosis procedures can be categorized using,False,False,False,False,False,False
intelligent computational classiﬁcation tasks. Data mining,False,False,False,False,False,False
is a process of analyzing and identifying previously un-,False,False,False,False,False,False
"known and hidden patterns, relationships and knowledge",False,False,False,False,False,False
from large datasets that was not possible with traditional,False,False,False,False,False,False
"techniques [1]. According to recent research, data mining",False,False,False,False,False,False
techniques are extremely helpful in the diagnosis of several,False,False,False,False,False,False
"diseases such as cancer [2], stroke [3], diabetes [4] and",False,False,False,False,False,False
heart disease [5].,False,False,False,False,False,False
Several classiﬁcation techniques are used for heart dis-,False,False,False,False,False,False
ease prediction; such as Naı,False,False,False,False,False,False
¨,False,False,False,False,False,False
"ve Bayes, linear regression,",False,False,False,False,False,False
"neural networks, support vector machine, and kernel den-",False,False,False,False,False,False
"sity, which results in different levels of precision, recall",False,False,False,False,False,False
and accuracy [5–7]. An ensemble approach shows,False,False,False,False,False,False
promising results as compared to a single technique [8];,False,False,False,False,False,False
"therefore, researchers have been investigating ensemble",False,False,False,False,False,False
based data mining approaches for heart disease prediction,False,False,False,False,False,False
showing fruitful results.,False,False,False,False,False,False
Figure 1 presents a generic ensemble framework for,False,False,False,False,True,False
prediction and evaluation of a disease. It is composed of,False,False,False,False,False,False
"training set, test set, model builder, ensemble model, pre-",False,False,False,False,False,False
diction and evaluation. This ensemble framework can also,False,False,False,False,False,False
"be applied to heart disease data. Heart disease datasets,",False,False,False,False,False,False
"with known class labels, are partitioned into training and",False,False,False,False,False,False
test sets. The training set is used to train the classiﬁers and,False,False,False,False,False,False
fed into a model builder which consists of individual,False,False,False,False,False,False
S. Bashir  U. Qamar  F. H. Khan (&),False,False,False,False,False,False
"Computer Engineering Department, College of Electrical and",False,False,False,False,False,False
"Mechanical Engineering, National University of Sciences and",False,False,False,False,False,False
"Technology (NUST), Islamabad, Pakistan",False,False,False,False,False,False
e-mail: farhan.hassan@ceme.nust.edu.pk,False,False,False,False,False,False
S. Bashir,False,False,False,False,False,False
e-mail: saba.bashir@ceme.nust.edu.pk,False,False,False,False,False,False
U. Qamar,False,False,False,False,False,False
e-mail: usmanq@ceme.nust.edu.pk,False,False,False,False,False,False
123,False,False,False,False,False,False
Australas Phys Eng Sci Med,False,False,False,False,False,False
DOI 10.1007/s13246-015-0337-6,False,False,False,False,False,False
classiﬁers. These trained classiﬁers are then combined us-,False,False,False,False,False,False
ing an ensemble technique. This ensemble model is then,False,False,False,False,False,False
executed on the test set and prediction is computed. Fi-,False,False,False,False,False,False
"nally, the performance is evaluated by comparing the",False,False,False,False,False,False
predicted results with other classiﬁers and ensembles.,False,False,False,False,False,False
This research paper presents a framework for intelligent,False,False,False,False,False,False
heart disease decision support system (DSS) using a novel,False,False,False,False,False,False
ensemble approach based on heterogeneous machine,False,False,False,False,False,False
learning techniques. The proposed framework results in,False,False,False,False,False,False
reliable performance for heart disease prediction as com-,False,False,False,False,False,False
pared to other classiﬁers. It integrates multiple heteroge-,False,False,False,False,False,False
neous classiﬁers using enhanced bagging with multi-,False,False,False,False,False,False
objective optimized weighted voting scheme.,False,False,False,False,False,False
Research contributions,False,False,False,False,False,False
Healthcare industry is continuously making an effort to,False,False,False,False,False,False
reduce medical errors and provide patient care and safety.,False,False,False,False,False,False
Adverse reactions can occur if a disease is not diagnosed,False,False,False,False,False,False
accurately. A DSS can assist health professionals for,False,False,False,False,False,False
decision making tasks such as diagnosis of heart disease,False,False,False,False,False,False
"from patient’s data. However, in medical applications",False,False,False,False,False,False
"decision quality is of crucial importance. Therefore, high",False,False,False,False,False,False
accuracy is of prime importance in heart disease classi-,False,False,False,False,False,False
ﬁcation and prediction. In this research we present a,False,False,False,False,False,False
complete DSS for accurate diagnosis of heart disease. It,False,False,False,False,False,False
can be used by health professionals for diagnosis of heart,False,False,False,False,False,False
disease from patient’s data. Whilst human decision-mak-,False,False,False,False,False,False
ing performance can be suboptimal and deteriorate as the,False,False,False,False,False,False
"complexity of the problem increases, the proposed",False,False,False,False,False,False
framework can help healthcare professionals to make,False,False,False,False,False,False
correct decisions.,False,False,False,False,False,False
The main contributions of the proposed research are,False,False,False,False,False,False
summarized as follows:,False,False,False,False,False,False
• A novel ensemble approach is proposed which uses,False,False,False,False,False,False
Bootstrap Aggregation (Bagging) with multi-objective,False,False,False,False,False,False
optimized weighted vote for diagnosis of heart disease.,False,False,False,False,False,False
• The proposed framework overcomes the limitations of,False,False,False,False,False,False
conventional performance by utilizing an ensemble of,False,False,False,False,False,False
ﬁve heterogeneous classiﬁers: Naı,False,False,False,False,False,False
¨,False,False,False,False,False,False
"ve Bayes, linear",False,False,False,False,False,False
"regression, quadratic discriminant analysis, instance",False,False,False,False,False,False
"based learner and support vector machines. However,",False,False,False,False,False,False
the proposed framework can be implemented using any,False,False,False,False,False,False
"set of classiﬁers which may be homogenous, heteroge-",False,False,False,False,False,False
neous or a combination of both.,False,False,False,False,False,False
• We compare the proposed ensemble approach with,False,False,False,False,False,False
existing classiﬁers and ensembles to prove the superi-,False,False,False,False,False,False
ority of our technique.,False,False,False,False,False,False
The rest of the paper is organized as follows: ‘‘Literature,False,False,False,False,False,False
review’’ section is related to literature review. The pro-,False,False,False,False,False,False
posed approach is deﬁned in ‘‘The proposed framework’’,False,False,False,False,False,False
section and ‘‘Dataset description’’section describes dataset,False,False,False,False,False,False
information. ‘‘Results and discussion’’ section presents the,False,False,False,False,False,False
"results and discussion sections. Finally, ‘‘Real-time im-",False,False,False,False,False,False
plementation of the proposed framework’’ section sum-,False,False,False,False,False,False
marizes the work which has been done.,False,False,False,False,False,False
There are various machine learning techniques that are,False,False,False,False,False,False
widely accepted for heart disease analysis and prediction.,False,False,False,False,False,False
A clinical decision support framework involves many,False,False,False,False,False,False
Datasets,False,False,False,False,False,False
0,False,False,False,False,False,False
1,False,False,False,False,False,False
1,False,False,False,False,False,False
0,False,False,False,False,False,False
Model Builder,False,False,False,False,False,False
0,False,False,False,False,False,False
1,False,False,False,False,False,False
0,False,False,False,False,False,False
1,False,False,False,False,False,False
Results known,False,False,False,False,False,False
Training set,False,False,False,False,False,False
Evaluate,False,False,False,False,False,False
Predictions,False,False,False,False,False,False
Testing set,False,False,False,False,False,False
Ensemble ,False,False,False,False,False,False
Model,False,False,False,False,False,False
Australas Phys Eng Sci Med,False,False,False,False,False,False
123,False,False,False,False,False,False
machine learning algorithms. Table 1 shows comparison of,False,False,False,False,False,False
"accuracy, sensitivity and speciﬁcity for different techniques",False,False,False,False,False,False
used for heart disease diagnosis. It is observed from,False,False,False,False,False,False
Table 1 that most of the work is focused on applying a,False,False,False,False,False,True
single classiﬁcation technique for heart disease analysis,False,False,False,False,False,False
and prediction. Pattekari and Parveen [9] used Naı,False,False,False,False,False,False
¨,False,False,False,False,False,False
ve Bayes,False,False,False,False,False,False
for heart disease prediction. The proposed technique uses a,False,False,False,False,False,False
single classiﬁer and works only on categorical data. The,False,False,False,False,False,False
technique can be improved by using other data mining,False,False,False,False,False,False
"techniques such as time series, clustering and association",False,False,False,False,False,False
mining whereas the results can be improved by considering,False,False,False,False,False,False
other data types as well. Peter and Somasundaram [10],False,False,False,False,False,False
proposed a cardiovascular disease risk prediction frame-,False,False,False,False,False,False
work by using data mining and pattern recognition tech-,False,False,False,False,False,False
niques. Analysis of results indicates that Naı,False,False,False,False,False,False
¨,False,False,False,False,False,False
ve Bayes has,False,False,False,False,False,False
better accuracy as compared to other techniques. The,False,False,False,False,False,False
proposed technique limits the use of only numerical at-,False,False,False,False,False,False
tribute set and input of attribute set is in ASCII ﬁle format.,False,False,False,False,False,False
Ghumbre et al. [11] proposed a system that used radial,False,False,False,False,False,False
based function network structure and support vector ma-,False,False,False,False,False,False
chine for heart disease prediction. The results indicate that,False,False,False,False,False,False
the accuracy of support vector machine is as good as radial,False,False,False,False,False,False
based function network. The technique is sensitive to data,False,False,False,False,False,False
acquisition method used. Chitra and Seenivasagam [12],False,False,False,False,False,False
used a supervised learning algorithm for prediction of heart,False,False,False,False,False,False
disease at early stages. The proposed classiﬁer is based on,False,False,False,False,False,False
cascaded neural network (CNN) with hidden neurons. High,False,False,False,False,False,False
speciﬁcity and sensitivity values show that the technique,False,False,False,False,False,False
has a high probability of predicting healthy individuals and,False,False,False,False,False,False
patients with heart disease.,False,False,False,False,False,False
Chen et al. [13] presented a framework for heart disease,False,False,False,False,False,False
analysis and prediction using learning vector quantization,False,False,False,False,False,False
(LVQ) algorithm. It uses ROC curve to display results and,False,False,False,False,False,False
achieved 80 % accuracy. Enhancements can be made by,False,False,False,False,False,False
using text mining techniques along with data mining. Text,False,False,False,False,False,False
mining has the capability to mine unstructured data avail-,False,False,False,False,False,False
able in heart disease datasets. Jabbar et al. [14] used as-,False,False,False,False,False,False
sociation mining and genetic algorithm for heart disease,False,False,False,False,False,False
prediction. High values of interestingness measure and,False,False,False,False,False,False
accuracy were achieved. The framework used entire at-,False,False,False,False,False,False
tribute set as input which can be further improved by,False,False,False,False,False,False
"feature reduction, selecting only those features that con-",False,False,False,False,False,False
tribute towards the diagnosis of the disease.,False,False,False,False,False,False
Valente et al. [15] used multivariate linear regression,False,False,False,False,False,False
(MLR) to study the relationship between MLR spatial ac-,False,False,False,False,False,False
tivation patterns and behavioral ratings. Model coefﬁcients,False,False,False,False,False,False
are used to perform mapping and sought-after links are,False,False,False,False,False,False
provided among different activities. It is concluded from,False,False,False,False,False,False
the experimentation that multiple linear regression models,False,False,False,False,False,False
are good for target modeling and it deals with high di-,False,False,False,False,False,False
mensional data. Rizk-Jackson et al. [16] proposed a,False,False,False,False,False,False
framework using support vector regression and linear re-,False,False,False,False,False,False
gression techniques in order to generate quantitative mea-,False,False,False,False,False,False
surements of disease progression. Different neuroimaging,False,False,False,False,False,False
measures were used to correlate the established measures,False,False,False,False,False,False
of disease progression. It is concluded from results that,False,False,False,False,False,False
there are different neuroimaging measures that are based,False,False,False,False,False,False
on multivariate measurements and disease-state biomarkers,False,False,False,False,False,False
can be established successfully. Maroco et al. [17] used,False,False,False,False,False,False
"different data mining techniques to improve accuracy,",False,False,False,False,False,False
sensitivity and speciﬁcity of results generated from neu-,False,False,False,False,False,False
ropsychological testing. The proposed technique compares,False,False,False,False,False,False
"linear discriminant analysis, quadratic discriminant analy-",False,False,False,False,False,False
sis and logistic regression to other seven non parametric,False,False,False,False,False,False
classiﬁers. Five fold cross validation is used to obtain the,False,False,False,False,False,False
statistical distribution of results.,False,False,False,False,False,False
As the ensemble approach outperforms individual clas-,False,False,False,False,False,False
"siﬁers, many such approaches have been introduced in",False,False,False,False,False,False
Author/year/reference Technique Speciﬁcity,False,False,False,False,False,False
(%),False,False,False,False,False,False
Sensitivity,False,False,False,False,False,False
(%),False,False,False,False,False,False
Accuracy,False,False,False,False,False,False
(%),False,False,False,False,False,False
Chen et al. 2011 [13] Artiﬁcial neural network 70 85 80,False,False,False,False,False,False
Das 2009 [5] Neural network ensemble 95.91 80.95 89.01,False,False,False,False,False,False
Ghumbre et al. 2011 [11] Support vector machine 88.50 84.06 85.05,False,False,False,False,False,False
Radial basis function 82.10 82.40 82.24,False,False,False,False,False,False
Chitra et al. 2013 [12] Cascaded neural network 87 83 85,False,False,False,False,False,False
Support vector machine 77.5 85.5 82,False,False,False,False,False,False
Shouman et al. 2011 [38] Nine voting equal frequency discretization gain ratio decision tree 85.2 77.9 84.1,False,False,False,False,False,False
Tu et al. 2009 [39] J4.8 decision tree 84.48 72.01 78.9,False,False,False,False,False,False
Bagging algorithm 86.64 74.93 81.41,False,False,False,False,False,False
Shouman et al. 2013 [40] Gain ratio decision tree 81.6 75.6 79.1,False,False,False,False,False,False
Naı,False,False,False,False,False,False
¨,False,False,False,False,False,False
ve Bayes 80.8 78 83.5,False,False,False,False,False,False
K nearest neighbor 85.1 76.7 83.2,False,False,False,False,False,False
Shouman et al. 2012 [41] K mean clustering with Naı,False,False,False,False,False,False
¨,False,False,False,False,False,False
ve Bayes algorithm 76.59 69.93 78.62,False,False,False,False,False,False
Australas Phys Eng Sci Med,False,False,False,False,False,False
123,False,False,False,False,False,False
recent decade. Das et al. [5] presented an ensemble based,False,False,False,False,False,False
method for diagnosis of heart disease. It combines different,False,False,False,False,False,False
neural networks that are trained using same dataset and,False,False,False,False,False,False
produce higher generalization. Only one heart disease,False,False,False,False,False,False
database is used for the proposed technique and more,False,False,False,False,False,False
datasets are required for veriﬁcation of results. Helmy et al.,False,False,False,False,False,False
"[18] proposed an ensemble framework based on SVM,",False,False,False,False,False,False
ANN and ANFIS to generate high prediction accuracy.,False,False,False,False,False,False
Individual classiﬁers were trained using bagging algorithm,False,False,False,False,False,False
and results reveal that heterogeneous ensemble has better,False,False,False,False,False,False
results as compared to individual classiﬁers. It used only,False,False,False,False,False,False
two datasets for result veriﬁcation and does not provide any,False,False,False,False,False,False
cross validation technique.,False,False,False,False,False,False
The proposed framework consists of two main,False,False,False,False,False,False
components.,False,False,False,False,False,False
(a) Data acquisition and pre-processing module.,False,False,False,False,False,False
"(b) BagMOOV, the ensemble model for heart disease",False,False,False,False,False,False
prediction.,False,False,False,False,False,False
The data acquisition process obtains data from different,False,False,False,False,False,False
"repositories, performs data partition and variable selection.",False,False,False,False,False,False
"Pre-processing steps involve: missing value imputation,",False,False,False,False,False,False
"outlier detection, feature selection and class label identiﬁ-",False,False,False,False,False,False
cation. This is then followed by training each classiﬁer,False,False,False,False,False,False
"using the training set and ﬁnally, the proposed ensemble",False,False,False,False,False,False
"model, BagMOOV combines ﬁve different classiﬁers. For",False,False,False,False,False,False
"each classiﬁer, the weight is calculated based on F-measure",False,False,False,False,False,False
of the training dataset. The ﬁnal output of the ensemble,False,False,False,False,False,False
"classiﬁer is the label with highest weighted vote [8, 19].",False,False,False,False,False,False
The ﬂowchart of the proposed approach is given in Fig. 2.,False,False,False,False,False,False
Data acquisition and pre-processing module,False,False,False,False,False,False
The basic purpose of data acquisition and pre-processing,False,False,False,False,False,False
module is to obtain data from different heart disease,False,False,False,False,False,False
repositories and then reﬁne them into a form that is suitable,False,False,False,False,False,False
for subsequent analysis. Each dataset holds the feature,False,False,False,False,False,False
space that will ultimately differentiate the data into healthy,False,False,False,False,False,False
individuals and sick (heart disease) patients. Each dataset,False,False,False,False,False,False
has different set of attributes and data types. The data is then,False,False,False,False,False,False
divided into training set and test set by data partition,False,False,False,False,False,False
component. Ten fold cross validation is used to partition the,False,False,False,False,False,False
dataset into ten mutually exclusive partitions. The biasness,False,False,False,False,False,False
is avoided by randomly selecting the samples from each,False,False,False,False,False,False
partition. The partitioning results in reduction of computa-,False,False,False,False,False,False
tion time for preliminary model runs. The pre-processing,False,False,False,False,False,False
phase involves multiple steps that are applied on each,False,False,False,False,False,False
"dataset sequentially. It includes feature selection, missing",False,False,False,False,False,False
"value imputation, noise removal and outlier detection.",False,False,False,False,False,False
• Feature selection This process involves feature reduc-,False,False,False,False,False,False
tion by selecting only those attributes which contribute,False,False,False,False,False,False
towards ﬁnal prediction of disease. The rejected features,False,False,False,False,False,False
will not be used for subsequent modules and analysis.,False,False,False,False,False,False
There are multiple steps involved in the process of,False,False,False,False,False,False
feature selection and identiﬁcation [20]. The generation,False,False,False,False,False,False
and selection procedures are two of the most important,False,False,False,False,False,False
steps. The generation procedure involves generation,False,False,False,False,False,False
features subset whereas selection procedure will evaluate,False,False,False,False,False,False
these features on the basis of different criteria. The,False,False,False,False,False,False
"generation procedure can result in an empty set, subset",False,False,False,False,False,False
based on randomly selected attributes or a set based on all,False,False,False,False,False,False
attributes. Forward selection is used in case of empty set,False,False,False,False,False,False
